<?xml version="1.0" encoding="UTF-8"?>

<root
    xmlns:xsi='http://www.w3.org/2001/XMLSchema-instance'
    xmlns='http://editor.huliqing.name'
    xsi:schemaLocation='http://editor.huliqing.name meta.xsd'>

    <converter name="EntityObjectDatasConverter" value="name.huliqing.editor.converter.field.EntityObjectDatasConverter" />
    <converter name="ActorSkillsConverter" value="name.huliqing.editor.converter.field.ActorSkillsConverter" />
    
    <data name="actor" extends="entityModelBase">
        <field name="file" converter="FileConverter">
            <feature name="filters" value="Model Files|*.j3o,All Files|*.*" />
        </field>
        <field name="icon" converter="FileConverter">
            <feature name="filters" value="Images|*.jpg|*.jpeg|*.png,All Files|*.*" />
        </field>
        <field name="channels" converter="EntityObjectDatasConverter">
            <feature name="dataType" value="name.huliqing.luoying.data.ChannelData" />
            <feature name="componentType" value="channel" />
            <feature name="collapsed" value="true" />
        </field>
        <field name="skills" converter="ActorSkillsConverter">
            <feature name="dataType" value="name.huliqing.luoying.data.SkillData" />
            <feature name="componentType" value="skill" />
            <feature name="collapsed" value="true" />
        </field>
        <field name="logics" converter="EntityObjectDatasConverter">
            <feature name="dataType" value="name.huliqing.luoying.data.LogicData" />
            <feature name="componentType" value="logic" />
            <feature name="collapsed" value="true" />
        </field>
        <field name="skins" converter="EntityObjectDatasConverter">
            <feature name="dataType" value="name.huliqing.luoying.data.SkinData" />
            <feature name="componentType" value="skin" />
            <feature name="collapsed" value="true" />
        </field>
        <field name="items" converter="EntityObjectDatasConverter">
            <feature name="dataType" value="name.huliqing.luoying.data.ItemData" />
            <feature name="componentType" value="item" />
            <feature name="collapsed" value="true" />
        </field>
        <field name="talents" converter="EntityObjectDatasConverter">
            <feature name="dataType" value="name.huliqing.luoying.data.TalentData" />
            <feature name="componentType" value="talent" />
            <feature name="collapsed" value="true" />
        </field>
        <field name="resists" converter="EntityObjectDatasConverter">
            <feature name="dataType" value="name.huliqing.luoying.data.ResistData" />
            <feature name="componentType" value="resist" />
            <feature name="collapsed" value="true" />
        </field>
        <field name="drops" converter="EntityObjectDatasConverter">
            <feature name="dataType" value="name.huliqing.luoying.data.DropData" />
            <feature name="componentType" value="drop" />
            <feature name="collapsed" value="true" />
        </field>
        <field name="effects" converter="EntityObjectDatasConverter">
            <feature name="dataType" value="name.huliqing.luoying.data.EffectData" />
            <feature name="componentType" value="effect" />
            <feature name="collapsed" value="true" />
        </field>
        <field name="localForward" converter="TextConverter">
            <feature name="collapsed" value="true" />
        </field>
        <field name="chat" converter="TextConverter">
            <feature name="collapsed" value="true" />
        </field>
    </data>
    
</root>
